{
  "name": "benchmarking_daily_metrics_backfill_ca",
  "owner": "DataEngineering",
  "assets": ["ca-central-1:product_analytics_staging.stg_organization_benchmark_metrics_daily"],
  "schedules": [
    {
      "name": "daily",
      "cron": "30 18 * * *",
      "backfill_window": 15,
      "backfill_batch_size": 1
    }
  ]
}
