{
  "name": "telematics_mpr_monthly",
  "owner": "DataEngineering",
  "assets": ["us-west-2:product_analytics.agg_product_scorecard_telematics_mpr_global_monthly"],
  "schedules": [
    {
      "name": "monthly",
      "cron": "00 15 1 * *",
      "backfill_window": 2,
      "backfill_batch_size": 1
    }
  ]
}
