{
  "name": "device_stats_primary_ca",
  "owner": "FirmwareVDP",
  "schedules": [
    {
      "name": "daily",
      "cron": "00 13 * * *",
      "backfill_window": 1,
      "backfill_batch_size": -1
    }
  ],
  "assets": [
    "ca-central-1:product_analytics.agg_device_stats_primary",
    "ca-central-1:product_analytics_staging.agg_population_quantile_rollup",
    "ca-central-1:product_analytics_staging.agg_population_quantiles",
    "ca-central-1:product_analytics_staging.agg_device_stats_quantiles",
    "ca-central-1:product_analytics_staging.fct_telematics_data_quality_cutoffs",
    "ca-central-1:product_analytics_staging.fct_telematics_data_quality_outliers"
  ]
}
