{
  "name": "device_stats_primary_eu",
  "owner": "FirmwareVDP",
  "schedules": [
    {
      "name": "daily",
      "cron": "00 13 * * *",
      "backfill_window": 1,
      "backfill_batch_size": -1
    }
  ],
  "assets": [
    "eu-west-1:product_analytics.agg_device_stats_primary",
    "eu-west-1:product_analytics_staging.agg_population_quantile_rollup",
    "eu-west-1:product_analytics_staging.agg_population_quantiles",
    "eu-west-1:product_analytics_staging.agg_device_stats_quantiles",
    "eu-west-1:product_analytics_staging.fct_telematics_data_quality_cutoffs",
    "eu-west-1:product_analytics_staging.fct_telematics_data_quality_outliers"
  ]
}
